{
  "version": 1,
  "studentId": "kirill_zinoviev",
  "date": "2026-10-28",
  "title": "Медиана, биссектриса и высота",
  "summary": "Медиана, биссектриса и высота треугольника: геометрия 7 класса, разбор, схемы, 10 упражнений и интерактивная лаборатория для Кирилла Зиновьева.",
  "topics": [
    "медиана треугольника и середина стороны",
    "биссектриса и равные углы",
    "высота и перпендикуляр к стороне или её продолжению",
    "три точки пересечения",
    "обозначения и чтение чертежа"
  ],
  "ktpRefs": [],
  "ktpCoverage": [],
  "outcomes": [
    {
      "competencyId": "triangles_5",
      "evidenceAnchor": "median",
      "relation": "practiced",
      "masteryClaim": null
    },
    {
      "competencyId": "triangles_6",
      "evidenceAnchor": "bisector",
      "relation": "practiced",
      "masteryClaim": null
    },
    {
      "competencyId": "triangles_7",
      "evidenceAnchor": "altitude",
      "relation": "practiced",
      "masteryClaim": null
    },
    {
      "competencyId": "triangles_13",
      "evidenceAnchor": "reading",
      "relation": "touched",
      "masteryClaim": null
    },
    {
      "competencyId": "geo_reason_8",
      "evidenceAnchor": "reading",
      "relation": "practiced",
      "masteryClaim": null
    }
  ],
  "materials": {
    "html": "28.10.26.html",
    "pdf": "../pdf_docs/28.10.26.pdf",
    "tex": "../tex_docs/28.10.26.tex",
    "lab": "28.10.26-lab.html"
  }
}
