{
  "version": 1,
  "studentId": "anna_bannova",
  "date": "2026-10-02",
  "title": "Степени",
  "summary": "Занятие Анны Банновой по степеням: восемь свойств, границы применимости, перевод составных чисел, корней и дробей в степенной вид, алгоритм преобразований и тренировка.",
  "topics": [
    "степени",
    "свойства степеней",
    "нулевая и отрицательная степень",
    "дробный показатель",
    "корни",
    "перевод в степенной вид",
    "преобразование степенных выражений"
  ],
  "ktpRefs": [
    "ktp-027",
    "ktp-029",
    "ktp-030"
  ],
  "ktpCoverage": [
    {
      "ktpId": "ktp-027",
      "coverage": "complete"
    },
    {
      "ktpId": "ktp-029",
      "coverage": "partial"
    },
    {
      "ktpId": "ktp-030",
      "coverage": "partial"
    }
  ],
  "outcomes": [
    {
      "competencyId": "calc_09",
      "evidenceAnchor": "lesson-evidence",
      "relation": "assessed",
      "masteryClaim": {
        "level": 2,
        "confidence": "exact",
        "basis": "На самостоятельных вычислительных примерах схема преобразования выбиралась верно, однако сохранялась нестабильность в факторизации и вычислительной точности."
      }
    },
    {
      "competencyId": "expr_12",
      "evidenceAnchor": "lesson-evidence",
      "relation": "assessed",
      "masteryClaim": {
        "level": 2,
        "confidence": "exact",
        "basis": "Каскад свойств степеней применялся по правильной логике; отдельная ошибка в разложении основания потребовала коррекции."
      }
    },
    {
      "competencyId": "calc_10",
      "evidenceAnchor": "roots",
      "relation": "practiced",
      "masteryClaim": null
    },
    {
      "competencyId": "calc_12",
      "evidenceAnchor": "roots",
      "relation": "practiced",
      "masteryClaim": null
    },
    {
      "competencyId": "expr_13",
      "evidenceAnchor": "roots",
      "relation": "practiced",
      "masteryClaim": null
    }
  ],
  "materials": {
    "html": "02.10.26.html",
    "pdf": "../pdf_docs/02.10.26.pdf",
    "tex": "../tex_docs/02.10.26.tex"
  }
}
