{
  "version": 1,
  "studentId": "nastya_pavlova",
  "date": "2026-10-29",
  "title": "Кредиты и вклады: схемы, формулы, расчёты",
  "summary": "Три схемы кредитования, расчёт дифференцированных платежей, двухлетний вклад с пополнением, поиск ставки по квадратному уравнению и вычисление больших корней.",
  "topics": [
    "Признаки трёх схем кредитования",
    "Пять формул дифференцированного кредита",
    "Вклад с капитализацией и пополнением",
    "Квадратное уравнение для определения ставки",
    "Извлечение больших квадратных корней"
  ],
  "ktpRefs": [],
  "ktpCoverage": [],
  "outcomes": [
    {
      "competencyId": "fin_06",
      "evidenceAnchor": "scheme",
      "relation": "practiced",
      "masteryClaim": null
    },
    {
      "competencyId": "fin_07",
      "evidenceAnchor": "scheme",
      "relation": "touched",
      "masteryClaim": null
    },
    {
      "competencyId": "fin_14",
      "evidenceAnchor": "formulas",
      "relation": "practiced",
      "masteryClaim": null
    },
    {
      "competencyId": "fin_15",
      "evidenceAnchor": "formulas",
      "relation": "practiced",
      "masteryClaim": null
    },
    {
      "competencyId": "fin_02",
      "evidenceAnchor": "deposits",
      "relation": "practiced",
      "masteryClaim": null
    },
    {
      "competencyId": "app_09",
      "evidenceAnchor": "deposits",
      "relation": "practiced",
      "masteryClaim": null
    },
    {
      "competencyId": "eq_02",
      "evidenceAnchor": "quadratic",
      "relation": "practiced",
      "masteryClaim": null
    },
    {
      "competencyId": "fin_16",
      "evidenceAnchor": "quadratic",
      "relation": "practiced",
      "masteryClaim": null
    },
    {
      "competencyId": "calc_10",
      "evidenceAnchor": "roots",
      "relation": "touched",
      "masteryClaim": null
    }
  ],
  "materials": {
    "html": "29.10.26.html",
    "lab": "29.10.26-lab.html"
  }
}
