{
  "version": 1,
  "studentId": "nadya_klimenko",
  "date": "2026-10-10",
  "title": "Смешанные числа: действия, скобки и задачи",
  "summary": "Сложение и вычитание смешанных чисел, занимание единицы, выражения со скобками, переход от десятичной дроби, уравнения и совместная работа.",
  "topics": [
    "смешанные числа",
    "сложение и вычитание дробей",
    "занимание единицы",
    "скобки",
    "десятичные дроби",
    "уравнения",
    "совместная работа"
  ],
  "ktpRefs": [],
  "ktpCoverage": [],
  "outcomes": [
    {
      "competencyId": "frac_04",
      "evidenceAnchor": "mixed",
      "relation": "practiced",
      "masteryClaim": null
    },
    {
      "competencyId": "frac_06",
      "evidenceAnchor": "carry",
      "relation": "practiced",
      "masteryClaim": null
    },
    {
      "competencyId": "frac_08",
      "evidenceAnchor": "decimals",
      "relation": "practiced",
      "masteryClaim": null
    },
    {
      "competencyId": "frac_09",
      "evidenceAnchor": "addition",
      "relation": "practiced",
      "masteryClaim": null
    },
    {
      "competencyId": "frac_11",
      "evidenceAnchor": "addition",
      "relation": "practiced",
      "masteryClaim": null
    },
    {
      "competencyId": "frac_12",
      "evidenceAnchor": "carry",
      "relation": "practiced",
      "masteryClaim": null
    },
    {
      "competencyId": "dec_07",
      "evidenceAnchor": "decimals",
      "relation": "practiced",
      "masteryClaim": null
    },
    {
      "competencyId": "alg_11",
      "evidenceAnchor": "equations",
      "relation": "practiced",
      "masteryClaim": null
    },
    {
      "competencyId": "alg_13",
      "evidenceAnchor": "equations",
      "relation": "practiced",
      "masteryClaim": null
    },
    {
      "competencyId": "nat_09",
      "evidenceAnchor": "brackets",
      "relation": "practiced",
      "masteryClaim": null
    },
    {
      "competencyId": "model_10",
      "evidenceAnchor": "pipes",
      "relation": "touched",
      "masteryClaim": null
    },
    {
      "competencyId": "model_11",
      "evidenceAnchor": "pipes",
      "relation": "touched",
      "masteryClaim": null
    },
    {
      "competencyId": "strategy_10",
      "evidenceAnchor": "check",
      "relation": "practiced",
      "masteryClaim": null
    }
  ],
  "materials": {
    "html": "10.10.26.html",
    "pdf": "../pdf_docs/10.10.26.pdf",
    "tex": "../tex_docs/10.10.26.tex"
  }
}
