{
  "version": 1,
  "studentId": "sofya_kalney",
  "date": "2026-07-13",
  "title": "Занятие 13.07.26",
  "summary": "Интерактивное пособие ОГЭ: растворы, смеси, сплавы, сушка и процентные изменения.",
  "topics": [],
  "ktpRefs": [],
  "outcomes": [],
  "materials": {
    "html": "13-07-26.html",
    "tex": "../tex_docs/13.07.26.tex"
  }
}
