{
  "version": 1,
  "studentId": "xenia_klykova",
  "date": "2026-10-21",
  "title": "От условия задачи к допустимому ответу",
  "summary": "ЕГЭ для Ксении Клыковой: колодец, вращение ведра, опорожнение бака, сплавы, сухофрукты и отбор допустимого ответа. Занятие 21 октября 2026.",
  "topics": [
    "прикладные формулы и моделирование",
    "падение камня и разность квадратов",
    "вращение ведра и граничное условие",
    "опорожнение цилиндрического бака",
    "сплавы и массовые доли",
    "высушивание и сохранение сухого вещества",
    "отбор допустимых значений"
  ],
  "ktpRefs": [],
  "ktpCoverage": [],
  "outcomes": [
    {
      "competencyId": "t9_power",
      "evidenceAnchor": "tank",
      "relation": "practiced",
      "masteryClaim": null
    },
    {
      "competencyId": "t9_units",
      "evidenceAnchor": "bucket",
      "relation": "practiced",
      "masteryClaim": null
    },
    {
      "competencyId": "t9_formula_transform",
      "evidenceAnchor": "bucket",
      "relation": "practiced",
      "masteryClaim": null
    },
    {
      "competencyId": "t10_validation",
      "evidenceAnchor": "tank",
      "relation": "practiced",
      "masteryClaim": null
    },
    {
      "competencyId": "t10_alloys",
      "evidenceAnchor": "mixtures",
      "relation": "practiced",
      "masteryClaim": null
    },
    {
      "competencyId": "t10_percent",
      "evidenceAnchor": "drying",
      "relation": "practiced",
      "masteryClaim": null
    }
  ],
  "materials": {
    "html": "21.10.26.html",
    "pdf": "../pdf_docs/21.10.26.pdf",
    "tex": "../tex_docs/21.10.26.tex",
    "lab": "21.10.26-lab.html"
  }
}
