{
  "version": 1,
  "studentId": "matvey_gorbachev",
  "date": "2026-09-24",
  "title": "Вектор как точное смещение",
  "summary": "Интерактивный конспект Матвея Горбачева: векторы на координатной плоскости, длина, операции, скалярное произведение и угол между векторами.",
  "topics": [],
  "ktpRefs": [],
  "outcomes": [],
  "materials": {
    "html": "24.09.26.html",
    "pdf": "../pdf_docs/24.09.26.pdf",
    "tex": "../tex_docs/24.09.26.tex",
    "lab": "24.09.26-lab.html"
  }
}
