{
  "version": 1,
  "studentId": "ivan_petrachenkov",
  "date": "2026-09-25",
  "title": "Путь и перемещение",
  "summary": "Иван Петраченков: интерактивный конспект по кинематике, пути, перемещению и равномерному движению.",
  "topics": [],
  "ktpRefs": [],
  "outcomes": [],
  "materials": {
    "html": "25.09.26.html",
    "pdf": "../pdf_docs/25.09.26.pdf",
    "tex": "../tex_docs/25.09.26.tex",
    "lab": "25.09.26-lab.html"
  }
}
