{
  "version": 1,
  "studentId": "ekaterina_gnedkova",
  "date": "2026-09-15",
  "title": "Степени в прикладных задачах",
  "summary": "Интерактивное занятие Екатерины Гнедковой: степени в прикладных задачах",
  "topics": [],
  "ktpRefs": [],
  "outcomes": [],
  "materials": {
    "html": "15.09.26.html",
    "pdf": "../pdf_docs/15.09.26.pdf",
    "tex": "../tex_docs/15.09.26.tex",
    "lab": "15.09.26-lab.html"
  }
}
