{
  "version": 1,
  "studentId": "kirill_zinoviev",
  "date": "2026-08-08",
  "title": "Повторение вычислений",
  "summary": "Интерактивное занятие Кирилла Зиновьева по повторению вычислений за 7 класс",
  "topics": [],
  "ktpRefs": [],
  "outcomes": [],
  "materials": {
    "html": "08.08.26.html",
    "pdf": "../pdf_docs/08.08.26.pdf",
    "tex": "../tex_docs/08.08.26.tex"
  }
}
