{
  "version": 1,
  "studentId": "jaroslav_vereschagin",
  "date": "2026-10-29",
  "title": "Сначала нуль. Потом знаки.",
  "summary": "29.10.26. Метод интервалов: нормализация квадратных и рациональных неравенств, общий множитель, скобки ВУПС, ОДЗ, общие знаменатели, замена повторяющегося квадратного выражения. Десять заданий Пути А.",
  "topics": [
    "Нормализация квадратных неравенств",
    "Вынесение общего множителя",
    "ОДЗ и нули знаменателя",
    "Приведение к общему знаменателю и правило ВУПС",
    "Метод интервалов и знаки",
    "Замена повторяющегося квадратного выражения"
  ],
  "ktpRefs": [],
  "ktpCoverage": [],
  "outcomes": [
    {
      "competencyId": "oge_20_2_1",
      "evidenceAnchor": "method",
      "relation": "practiced",
      "masteryClaim": null
    },
    {
      "competencyId": "oge_20_2_2",
      "evidenceAnchor": "domain",
      "relation": "practiced",
      "masteryClaim": null
    },
    {
      "competencyId": "oge_20_2_3",
      "evidenceAnchor": "fractions",
      "relation": "practiced",
      "masteryClaim": null
    },
    {
      "competencyId": "oge_20_2_4",
      "evidenceAnchor": "method",
      "relation": "practiced",
      "masteryClaim": null
    },
    {
      "competencyId": "oge_20_2_5",
      "evidenceAnchor": "training",
      "relation": "touched",
      "masteryClaim": null
    },
    {
      "competencyId": "oge_13_2_3",
      "evidenceAnchor": "normal",
      "relation": "practiced",
      "masteryClaim": null
    },
    {
      "competencyId": "oge_13_2_4",
      "evidenceAnchor": "factor",
      "relation": "practiced",
      "masteryClaim": null
    },
    {
      "competencyId": "oge_8_3_2",
      "evidenceAnchor": "substitution",
      "relation": "practiced",
      "masteryClaim": null
    }
  ],
  "materials": {
    "html": "29.10.26.html",
    "pdf": "../pdf_docs/29.10.26.pdf",
    "tex": "../tex_docs/29.10.26.tex"
  }
}
