{
  "version": 1,
  "studentId": "sofya_kalney",
  "date": "2026-10-16",
  "title": "Теорема Менелая и отношения отрезков",
  "summary": "Отношения отрезков, вспомогательная параллельная, подобие и теорема Менелая: урок геометрии Софии Кальней от 16 октября 2026 года.",
  "topics": [
    "Отношения отрезков в треугольнике",
    "Вспомогательная параллельная и подобие",
    "Теорема Менелая"
  ],
  "ktpRefs": [],
  "ktpCoverage": [],
  "outcomes": [
    {
      "competencyId": "oge_23_2_1",
      "evidenceAnchor": "menelaus",
      "relation": "practiced",
      "masteryClaim": null
    },
    {
      "competencyId": "oge_23_2_2",
      "evidenceAnchor": "menelaus",
      "relation": "practiced",
      "masteryClaim": null
    },
    {
      "competencyId": "oge_23_2_3",
      "evidenceAnchor": "second",
      "relation": "practiced",
      "masteryClaim": null
    },
    {
      "competencyId": "oge_24_2_3",
      "evidenceAnchor": "first",
      "relation": "touched",
      "masteryClaim": null
    },
    {
      "competencyId": "oge_25_1_2",
      "evidenceAnchor": "second",
      "relation": "practiced",
      "masteryClaim": null
    },
    {
      "competencyId": "oge_23_2_4",
      "evidenceAnchor": "check",
      "relation": "touched",
      "masteryClaim": null
    }
  ],
  "materials": {
    "html": "16.10.26.html",
    "pdf": "../pdf_docs/16.10.26.pdf",
    "lab": "16.10.26-lab.html"
  }
}
