{
  "version": 1,
  "studentId": "ekaterina",
  "date": "2026-10-17",
  "title": "Параллелограмм, прямоугольник и системы счисления",
  "summary": "Екатерина Скелли · свойства и признаки параллелограмма, доказательства, прямоугольник и перевод чисел между системами счисления · 17.10.2026",
  "topics": [
    "параллелограмм: свойства и признаки",
    "геометрические доказательства",
    "прямоугольник",
    "позиционные системы счисления",
    "триады и тетрады"
  ],
  "ktpRefs": [],
  "ktpCoverage": [],
  "outcomes": [
    {
      "competencyId": "geo_quads_02",
      "evidenceAnchor": "geometry",
      "relation": "touched",
      "masteryClaim": null
    },
    {
      "competencyId": "geo_quads_03",
      "evidenceAnchor": "geometry",
      "relation": "practiced",
      "masteryClaim": null
    },
    {
      "competencyId": "geo_quads_04",
      "evidenceAnchor": "geometry",
      "relation": "practiced",
      "masteryClaim": null
    },
    {
      "competencyId": "geo_quads_05",
      "evidenceAnchor": "geometry",
      "relation": "practiced",
      "masteryClaim": null
    },
    {
      "competencyId": "geo_quads_06",
      "evidenceAnchor": "proofs",
      "relation": "practiced",
      "masteryClaim": null
    },
    {
      "competencyId": "geo_quads_07",
      "evidenceAnchor": "rectangle",
      "relation": "practiced",
      "masteryClaim": null
    }
  ],
  "materials": {
    "html": "17.10.26.html",
    "pdf": "../pdf_docs/17.10.26.pdf",
    "tex": "../tex_docs/17.10.26.tex"
  }
}
