{
  "version": 1,
  "studentId": "matvey_gorbachev",
  "date": "2026-09-27",
  "title": "Из текста — в математическую модель",
  "summary": "Интерактивный конспект Матвея Горбачева: прикладные задачи, формулы, единицы измерения, квадратные уравнения и отбор корней.",
  "topics": [],
  "ktpRefs": [],
  "outcomes": [],
  "materials": {
    "html": "27.09.26.html",
    "pdf": "../pdf_docs/27.09.26.pdf",
    "tex": "../tex_docs/27.09.26.tex",
    "lab": "27.09.26-lab.html"
  }
}
