{
  "version": 1,
  "studentId": "kirill_zinoviev",
  "date": "2026-10-17",
  "title": "Функция и её значения",
  "summary": "Кирилл Зиновьев, 17 октября 2026: аргумент и значение функции, таблицы с шагом и область определения. Примеры, алгоритм и 10 задач Путь А.",
  "topics": [
    "аргумент и значение функции",
    "подстановка отрицательных чисел",
    "таблицы значений с шагом",
    "область определения функции",
    "исключение нулей знаменателя"
  ],
  "ktpRefs": [],
  "ktpCoverage": [],
  "outcomes": [
    {
      "competencyId": "functions_2",
      "evidenceAnchor": "argument",
      "relation": "practiced",
      "masteryClaim": null
    },
    {
      "competencyId": "expr_2",
      "evidenceAnchor": "argument",
      "relation": "practiced",
      "masteryClaim": null
    },
    {
      "competencyId": "powers_3",
      "evidenceAnchor": "negative",
      "relation": "practiced",
      "masteryClaim": null
    },
    {
      "competencyId": "functions_3",
      "evidenceAnchor": "table",
      "relation": "practiced",
      "masteryClaim": null
    },
    {
      "competencyId": "fractions_2",
      "evidenceAnchor": "domain",
      "relation": "touched",
      "masteryClaim": null
    }
  ],
  "materials": {
    "html": "17.10.26.html",
    "pdf": "../pdf_docs/17.10.26.pdf",
    "tex": "../tex_docs/17.10.26.tex",
    "lab": "17.10.26-lab.html"
  }
}
