{
  "version": 1,
  "studentId": "kirill_zinoviev",
  "date": "2026-10-10",
  "title": "Углы и отрезки",
  "summary": "Биссектриса, смежные и вертикальные углы, отрезки на одном луче, деление отрезка в отношении, согласованность чертежа и вычислений.",
  "topics": [
    "биссектриса угла",
    "смежные углы",
    "вертикальные углы",
    "отрезки на одном луче",
    "деление отрезка в отношении",
    "оформление геометрической задачи"
  ],
  "ktpRefs": [],
  "ktpCoverage": [],
  "outcomes": [
    {
      "competencyId": "geo_base_11",
      "evidenceAnchor": "bisector",
      "relation": "touched",
      "masteryClaim": null
    },
    {
      "competencyId": "geo_base_7",
      "evidenceAnchor": "adjacent",
      "relation": "practiced",
      "masteryClaim": null
    },
    {
      "competencyId": "geo_base_8",
      "evidenceAnchor": "adjacent",
      "relation": "practiced",
      "masteryClaim": null
    },
    {
      "competencyId": "geo_base_9",
      "evidenceAnchor": "vertical",
      "relation": "practiced",
      "masteryClaim": null
    },
    {
      "competencyId": "geo_base_10",
      "evidenceAnchor": "vertical",
      "relation": "practiced",
      "masteryClaim": null
    },
    {
      "competencyId": "geo_reason_8",
      "evidenceAnchor": "segments",
      "relation": "practiced",
      "masteryClaim": null
    },
    {
      "competencyId": "percent_1",
      "evidenceAnchor": "ratio",
      "relation": "practiced",
      "masteryClaim": null
    },
    {
      "competencyId": "models_13",
      "evidenceAnchor": "ratio",
      "relation": "touched",
      "masteryClaim": null
    },
    {
      "competencyId": "models_5",
      "evidenceAnchor": "segments",
      "relation": "touched",
      "masteryClaim": null
    }
  ],
  "materials": {
    "html": "10.10.26.html",
    "pdf": "../pdf_docs/10.10.26.pdf",
    "tex": "../tex_docs/10.10.26.tex",
    "lab": "10.10.26-lab.html"
  }
}
