{
  "version": 1,
  "studentId": "nikol_sarkisyants",
  "date": "2026-08-04",
  "title": "Дифференцированная схема кредитования",
  "summary": "",
  "topics": [],
  "ktpRefs": [],
  "outcomes": [],
  "materials": {
    "html": "04.08.26.html",
    "pdf": "../pdf_docs/04.08.26.pdf",
    "tex": "../tex_docs/04.08.26.tex"
  }
}
