{
  "version": 1,
  "studentId": "timofey",
  "date": "2026-07-17",
  "title": "Занятие 17.07.26",
  "summary": "Показательные неравенства повышенной сложности: модуль, группировка и разность степеней.",
  "topics": [],
  "ktpRefs": [],
  "outcomes": [],
  "materials": {
    "html": "lessons/17-07-26.html",
    "pdf": "../pdf_docs/17.07.26.pdf",
    "tex": "../tex_docs/17.07.26.tex"
  }
}
