{
  "version": 1,
  "studentId": "ekaterina_gnedkova",
  "date": "2026-09-25",
  "title": "Текстовые задачи",
  "summary": "Текстовые задачи: движение, средняя скорость, протяжённые тела и производительность. Персональный конспект Екатерины Гнедковой от 25.09.26.",
  "topics": [],
  "ktpRefs": [],
  "outcomes": [],
  "materials": {
    "html": "25.09.26.html",
    "pdf": "../pdf_docs/25.09.26.pdf",
    "tex": "../tex_docs/25.09.26.tex"
  }
}
