{
  "version": 1,
  "studentId": "nadya_klimenko",
  "date": "2026-10-13",
  "title": "Смешанные числа и текстовые задачи",
  "summary": "Надя Клименко, 13.10.26. Смешанные числа и математические модели: уравнения, движение по реке, три рейса и совместная работа.",
  "topics": [
    "смешанные числа",
    "сложение и вычитание дробей",
    "уравнения по тексту",
    "движение по реке",
    "задачи на части",
    "совместная работа"
  ],
  "ktpRefs": [],
  "ktpCoverage": [],
  "outcomes": [
    {
      "competencyId": "frac_04",
      "evidenceAnchor": "arithmetic",
      "relation": "practiced",
      "masteryClaim": null
    },
    {
      "competencyId": "frac_08",
      "evidenceAnchor": "arithmetic",
      "relation": "practiced",
      "masteryClaim": null
    },
    {
      "competencyId": "frac_09",
      "evidenceAnchor": "arithmetic",
      "relation": "practiced",
      "masteryClaim": null
    },
    {
      "competencyId": "frac_11",
      "evidenceAnchor": "arithmetic",
      "relation": "practiced",
      "masteryClaim": null
    },
    {
      "competencyId": "frac_12",
      "evidenceAnchor": "arithmetic",
      "relation": "practiced",
      "masteryClaim": null
    },
    {
      "competencyId": "dec_07",
      "evidenceAnchor": "arithmetic",
      "relation": "practiced",
      "masteryClaim": null
    },
    {
      "competencyId": "nat_09",
      "evidenceAnchor": "arithmetic",
      "relation": "practiced",
      "masteryClaim": null
    },
    {
      "competencyId": "alg_11",
      "evidenceAnchor": "equations",
      "relation": "practiced",
      "masteryClaim": null
    },
    {
      "competencyId": "alg_13",
      "evidenceAnchor": "equations",
      "relation": "practiced",
      "masteryClaim": null
    },
    {
      "competencyId": "model_01",
      "evidenceAnchor": "models",
      "relation": "practiced",
      "masteryClaim": null
    },
    {
      "competencyId": "model_02",
      "evidenceAnchor": "models",
      "relation": "practiced",
      "masteryClaim": null
    },
    {
      "competencyId": "model_03",
      "evidenceAnchor": "trips",
      "relation": "practiced",
      "masteryClaim": null
    },
    {
      "competencyId": "model_09",
      "evidenceAnchor": "river",
      "relation": "practiced",
      "masteryClaim": null
    },
    {
      "competencyId": "model_10",
      "evidenceAnchor": "joint",
      "relation": "touched",
      "masteryClaim": null
    },
    {
      "competencyId": "model_11",
      "evidenceAnchor": "joint",
      "relation": "touched",
      "masteryClaim": null
    },
    {
      "competencyId": "strategy_02",
      "evidenceAnchor": "trips",
      "relation": "practiced",
      "masteryClaim": null
    },
    {
      "competencyId": "strategy_10",
      "evidenceAnchor": "reflect",
      "relation": "practiced",
      "masteryClaim": null
    }
  ],
  "materials": {
    "html": "13.10.26.html",
    "pdf": "../pdf_docs/13.10.26.pdf",
    "tex": "../tex_docs/13.10.26.tex"
  }
}
