{
  "version": 1,
  "studentId": "nastya_pavlova",
  "date": "2026-09-21",
  "title": "Векторы на координатной плоскости",
  "summary": "Интерактивное занятие Анастасии Павловой: координаты и длина вектора, действия с векторами, скалярное произведение и косинус угла",
  "topics": [],
  "ktpRefs": [],
  "outcomes": [],
  "materials": {
    "html": "21.09.26.html",
    "pdf": "../pdf_docs/21.09.26.pdf",
    "tex": "../tex_docs/21.09.26.tex",
    "lab": "21.09.26-lab.html"
  }
}
