{
  "version": 1,
  "studentId": "sofya_kalney",
  "date": "2026-10-09",
  "title": "Высоты, касательные и отношения отрезков",
  "summary": "Высоты и площади, касательные к окружности, теорема Фалеса и отношения отрезков. Геометрия ОГЭ, занятие Софии Кальней 09.10.2026.",
  "topics": [
    "Высоты и площади",
    "Формула Герона",
    "Касательные к окружности",
    "Теорема Фалеса",
    "Отношения отрезков и подобие"
  ],
  "ktpRefs": [],
  "ktpCoverage": [],
  "outcomes": [
    {
      "competencyId": "oge_23_2_1",
      "evidenceAnchor": "areas",
      "relation": "touched",
      "masteryClaim": null
    },
    {
      "competencyId": "oge_25_1_4",
      "evidenceAnchor": "areas",
      "relation": "practiced",
      "masteryClaim": null
    },
    {
      "competencyId": "oge_23_2_3",
      "evidenceAnchor": "isosceles",
      "relation": "practiced",
      "masteryClaim": null
    },
    {
      "competencyId": "oge_16_2_3",
      "evidenceAnchor": "tangents",
      "relation": "practiced",
      "masteryClaim": null
    },
    {
      "competencyId": "oge_24_2_2",
      "evidenceAnchor": "tangents",
      "relation": "touched",
      "masteryClaim": null
    },
    {
      "competencyId": "oge_25_1_5",
      "evidenceAnchor": "thales",
      "relation": "practiced",
      "masteryClaim": null
    }
  ],
  "materials": {
    "html": "09.10.26.html",
    "pdf": "../pdf_docs/09.10.26.pdf",
    "tex": "../tex_docs/09.10.26.tex"
  }
}
