{
  "version": 1,
  "studentId": "nastya_pavlova",
  "date": "2026-09-07",
  "title": "Показательные уравнения",
  "summary": "Анастасия Павлова — показательные уравнения, занятие 07.09.26",
  "topics": [],
  "ktpRefs": [],
  "outcomes": [],
  "materials": {
    "html": "07.09.26.html",
    "pdf": "../pdf_docs/07.09.26.pdf",
    "tex": "../tex_docs/07.09.26.tex"
  }
}
