{
  "version": 1,
  "studentId": "jaroslav_vereschagin",
  "date": "2026-09-14",
  "title": "Степени, корни, уравнения и системы",
  "summary": "Интерактивное занятие Ярослава Верещагина: степени, квадратные корни, уравнения и системы",
  "topics": [],
  "ktpRefs": [],
  "outcomes": [],
  "materials": {
    "html": "14.09.26.html",
    "pdf": "../pdf_docs/14.09.26.pdf",
    "tex": "../tex_docs/14.09.26.tex",
    "lab": "14.09.26-lab.html"
  }
}
